<?xml version="1.0" standalone="no" ?>
<!DOCTYPE scene SYSTEM "scene.dtd">

<scene output_file="7_dof.png">
  <background_color r="0.0" g="0.0" b="0.0"/>
  <camera>
    <position x="2.0" y="2.0" z="1.0"/>
    <lookat x="0.0" y="1.5" z="-2.5"/>
    <up x="0.0" y="1.0" z="0.0"/>
    <horizontal_fov angle="45"/>
    <resolution horizontal="512" vertical="512"/>
    <max_bounces n="8"/>
    <supersampling subpixels_peraxis="7"/>
    <dof x="0.71" y="0.5" z="-2.29" lenssize="0.25"/>
  </camera>
  <lights>
    <ambient_light>
      <color r="1.0" g="1.0" b="1.0"/>
    </ambient_light>
    <point_light>
      <color r="0.5" g="0.5" b="0.5"/>
      <position x="2.0" y="3.0" z="-2.5"/>
    </point_light>
    <point_light>
      <color r="0.5" g="0.5" b="0.5"/>
      <position x="-2.0" y="3.0" z="-2.5"/>
    </point_light>
    <point_light>
      <color r="0.5" g="0.5" b="0.5"/>
      <position x="0.0" y="0.0" z="-0.5"/>
    </point_light>
  </lights>
  <surfaces>
    <sphere radius="1.0">
      <position x="-2.1" y="1.5" z="-6.0"/>
      <material_textured>
        <texture name="mramor6x6.png"/>
        <phong ka="0.3" kd="0.9" ks="1.0" exponent="200"/>
        <reflectance r="0.0"/>
        <transmittance t="0.0"/>
        <refraction iof="0.0"/>
      </material_textured>
    </sphere>
    <sphere radius="1.0">
      <position x="0.0" y="0.5" z="-3.0"/>
      <material_textured>
        <texture name="mramor6x6.png"/>
        <phong ka="0.5" kd="0.9" ks="1.0" exponent="200"/>
        <reflectance r="0.0"/>
        <transmittance t="0.0"/>
        <refraction iof="0.0"/>
      </material_textured>
    </sphere>
    <sphere radius="1.0">
      <position x="2.1" y="-1.5" z="-7.0"/>
      <material_textured>
        <texture name="mramor6x6.png"/>
        <phong ka="0.3" kd="0.7" ks="1.0" exponent="200"/>
        <reflectance r="0.0"/>
        <transmittance t="0.0"/>
        <refraction iof="0.0"/>
      </material_textured>
    </sphere>
    <sphere radius="1.0">
      <position x="-2.1" y="-1.5" z="-3.0"/>
      <material_textured>
        <texture name="mramor6x6.png"/>
        <phong ka="0.3" kd="0.9" ks="1.0" exponent="200"/>
        <reflectance r="0.0"/>
        <transmittance t="0.0"/>
        <refraction iof="0.0"/>
      </material_textured>
    </sphere>
    <sphere radius="1.0">
      <position x="1.4" y="2.8" z="-5.7"/>
      <material_textured>
        <texture name="mramor6x6.png"/>
        <phong ka="0.5" kd="0.6" ks="1.0" exponent="200"/>
        <reflectance r="0.0"/>
        <transmittance t="0.0"/>
        <refraction iof="0.0"/>
      </material_textured>
    </sphere>
    <sphere radius="1.0">
      <position x="-2.0" y="2.5" z="-3.0"/>
      <material_textured>
        <texture name="mramor6x6.png"/>
        <phong ka="0.3" kd="0.9" ks="1.0" exponent="200"/>
        <reflectance r="0.0"/>
        <transmittance t="0.0"/>
        <refraction iof="0.0"/>
      </material_textured>
    </sphere>
    <mesh name="open_room.obj">
      <material_textured>
        <texture name="rainbow.png"/>
        <phong ka="0.3" kd="0.9" ks="1.0" exponent="20"/>
        <reflectance r="0.0"/>
        <transmittance t="0.0"/>
        <refraction iof="0.0"/>
      </material_textured>
    </mesh>
  </surfaces>
</scene>
