<?xml version="1.0" standalone="no" ?>
<!DOCTYPE scene SYSTEM "scene.dtd">

<scene output_file="9_caustic.png">
    <background_color r="0.0" g="0.0" b="0.0"/>
    <caustic steps="2400" texture_size="300" factor="0.0225"/>
    <camera>
        <position x="2.9" y="1.9" z="-3.3"/>
        <lookat x="0.0" y="0.0" z="-6.5"/>
        <up x="0.0" y="1.0" z="0.0"/>
        <horizontal_fov angle="38"/>
        <resolution horizontal="512" vertical="512"/>
        <max_bounces n="8"/>
        <supersampling subpixels_peraxis="1"/>
    </camera>
    <lights>
        <ambient_light>
            <color r="1.0" g="1.0" b="1.0"/>
        </ambient_light>
        <point_light>
            <color r="0.7" g="0.7" b="0.7"/>
            <position x="2.0" y="3.0" z="-2.5"/>
        </point_light>
        <point_light>
            <color r="0.7" g="0.7" b="0.7"/>
            <position x="-2.0" y="3.0" z="-2.5"/>
        </point_light>
    </lights>
    <surfaces>
        <mesh name="open_room.obj">
            <material_solid>
                <color r="0.6" g="0.6" b="0.6"/>
                <phong ka="0.3" kd="0.9" ks="0.8" exponent="200"/>
                <reflectance r="0.0"/>
                <transmittance t="0.0"/>
                <refraction iof="0.0"/>
            </material_solid>
        </mesh>
        <mesh name="box2.obj">
            <material_solid>
                <color r="0.17" g="0.18" b="0.50"/>
                <phong ka="0.0" kd="0.0" ks="0.0" exponent="200"/>
                <reflectance r="0.8"/>
                <transmittance t="0.8"/>
                <refraction iof="1.5168" ec="9.7525e-9" disp="-0.15"/>
            </material_solid>
        </mesh>
    </surfaces>
</scene>
