<?xml version="1.0" standalone="no" ?>
<!DOCTYPE scene SYSTEM "scene.dtd">

<scene output_file="101_julia_shiny.png">
    <background_color r="0.0" g="0.0" b="0.1" a="1"/>
    <camera>
        <position x="0.0" y="0.0" z="1.0"/>
        <lookat x="0.0" y="0.0" z="-2.5"/>
        <up x="0.0" y="1.0" z="0.0"/>
        <horizontal_fov angle="22.5"/>
        <resolution horizontal="640" vertical="400"/>
        <supersampling subpixels_peraxis="2"/>
        <max_bounces n="5"/>
    </camera>
    <lights>
        <ambient_light>
            <color r="0.1" g="0.1" b="0.1"/>
        </ambient_light>
        <point_light>
            <color r="0.25" g="0.55" b="0.05"/>
            <position x="-30" y="25" z="0"/>
        </point_light>
        <point_light>
            <color r="0.45" g="0.45" b="0.45"/>
            <position x="2.0" y="5.0" z="0"/>
        </point_light>
        <point_light>
            <color r="0.0" g="0.0" b="0.45"/>
            <position x="20" y="0" z="-20"/>
        </point_light>
    </lights>
    <surfaces>
        <julia scale="13" cr="-0.291" ca="-0.399" cb="0.339" cc="0.437" cutplane="0.0">
            <position x="0" y="3" z="-55"/>
            <material_solid>
                <color r="0.0" g="0.6" b="1"/>
                <phong ka="0.9" kd="1" ks="9" exponent="80"/>
                <reflectance r="0"/>
                <transmittance t="1"/>
                <refraction iof="1.0" ec="1"/>
            </material_solid>
        </julia>
        <mesh name="plane_small.obj">
            <material_solid>
                <color r="0.3" g="0.2" b="0.3"/>
                <phong ka="0.0" kd="0" ks="0" exponent="80"/>
                <reflectance r="1"/>
                <transmittance t="0"/>
                <refraction iof="1.5" ec="1"/>
            </material_solid>
            <transform>
                <translate x="0.0" y="-8" z="-292.5"/>
                <scale x="100" y="1" z="297.5"/>
                <rotateX theta="-90.0"/>
            </transform>
        </mesh>
    </surfaces>
</scene>