<?xml version="1.0" standalone="no" ?>
<!DOCTYPE scene SYSTEM "scene.dtd">

<scene output_file="102_fresnel_animation.png">
    <background_color r="0.0" g="0.0" b="0.0"/>
  <animation length="2" fps="13"/>
    <camera>
        <position x="0;3(b)" y="0;2(b)" z="-2;-4(b)"/>
        <lookat x="0.0" y="0.0" z="-6.5"/>
        <up x="0.0" y="1.0" z="0.0"/>
        <horizontal_fov angle="45"/>
        <resolution horizontal="300" vertical="300"/>
        <max_bounces n="8"/>
    </camera>
    <lights>
        <ambient_light>
            <color r="1.0" g="1.0" b="1.0"/>
        </ambient_light>
        <point_light>
            <color r="0.7" g="0.7" b="0.7"/>
            <position x="2.0" y="3.0" z="-2.5"/>
        </point_light>
        <point_light>
            <color r="0.7" g="0.7" b="0.7"/>
            <position x="-2.0" y="3.0" z="-2.5"/>
        </point_light>
    </lights>
    <surfaces>
        <mesh name="open_room.obj">
            <material_solid>
                <color r="0.6" g="0.6" b="0.6"/>
                <phong ka="0.3" kd="0.9" ks="1.0" exponent="20"/>
                <reflectance r="0.0"/>
                <transmittance t="0.0"/>
                <refraction iof="0.0"/>
            </material_solid>
        </mesh>
        <mesh name="wall.obj">
            <material_textured>
                <texture name="mramor6x6.png"/>
                <phong ka="0.3" kd="0.9" ks="1.0" exponent="200"/>
                <reflectance r="0.0"/>
                <transmittance t="0.0"/>
                <refraction iof="0.0"/>
            </material_textured>
        </mesh>
      <mesh name="box2.obj">
        <material_solid>
          <color r="0.17" g="0.18" b="0.50"/>
          <phong ka="0.0" kd="0.0" ks="0.0" exponent="200"/>
          <reflectance r="0.8"/>
          <transmittance t="0.8"/>
          <refraction iof="1.5168" ec="9.7525e-9" disp="-0.2"/>
        </material_solid>
      </mesh>
    </surfaces>
</scene>
