<?xml version="1.0" standalone="no" ?>
<!DOCTYPE scene SYSTEM "scene.dtd">

<scene output_file="5_julia_animation.png">
    <background_color r="0.0" g="0.0" b="0.0" a="1"/>
    <animation length="3.0" fps="15"/>
    <camera>
        <position x="0.0" y="0.0" z="1.0"/>
        <lookat x="0.0" y="0.0" z="-2.5"/>
        <up x="0.0" y="1.0" z="0.0"/>
        <horizontal_fov angle="45"/>
        <resolution horizontal="512" vertical="512"/>
        <max_bounces n="8"/>
    </camera>
    <lights>
        <ambient_light>
            <color r="1.0" g="1.0" b="1.0"/>
        </ambient_light>
        <point_light>
            <color r="0.7" g="0.7" b="0.7"/>
            <position x="2.0" y="3.0" z="-1.5"/>
        </point_light>
        <point_light>
            <color r="0.7" g="0.7" b="0.7"/>
            <position x="-2.0" y="3.0" z="-1.5"/>
        </point_light>
    </lights>
    <surfaces>
        <julia scale="2" cr="-0.291" ca="-0.399" cb="0.339" cc="0.437" cutplane="-1;1">
            <position x="0.0" y="0.0" z="-4.0"/>
            <material_solid>
                <color r="0.37" g="0.38" b="0.70"/>
                <phong ka="0.3" kd="0.9" ks="0.6" exponent="200"/>
                <reflectance r="0.0"/>
                <transmittance t="0.0"/>
                <refraction iof="0.0"/>
            </material_solid>
        </julia>
    </surfaces>
</scene>
