<?xml version="1.0" standalone="no" ?>
<!DOCTYPE scene SYSTEM "scene.dtd">

<scene output_file="104_julia_animation.png">
    <background_color r="0.0" g="0.0" b="0.1" a="1"/>
    <animation length="5" fps="15"/>
    <camera>
        <position x="0;20(b,0.5);0.0" y="0.0;20(b,0.5);0.0" z="0.0;-20(b,0.5);0.0"/>
        <lookat x="0.0" y="0.0;3(b,0.5);0.0" z="-55"/>
        <up x="0.0" y="1.0" z="0.0"/>
        <horizontal_fov angle="22.5"/>
        <resolution horizontal="320" vertical="200"/>
        <supersampling subpixels_peraxis="1"/>
        <max_bounces n="8"/>
    </camera>
    <lights>
        <ambient_light>
            <color r="0.1" g="0.1" b="0.1"/>
        </ambient_light>
        <point_light>
            <color r="0.25" g="0.55" b="0.05"/>
            <position x="-30" y="25" z="0"/>
        </point_light>
        <point_light>
            <color r="0.45" g="0.45" b="0.45"/>
            <position x="2.0" y="5.0" z="0"/>
        </point_light>
        <point_light>
            <color r="0.0" g="0.0" b="0.45"/>
            <position x="20" y="0" z="-20"/>
        </point_light>
    </lights>
    <surfaces>
        <julia scale="13" cr="-0.291" ca="-0.399" cb="0.339" cc="0.437" cutplane="-1;1">
            <position x="0" y="3" z="-55"/>
            <material_solid>
                <color r="0.0" g="0.6" b="1"/>
                <phong ka="0.9" kd="1" ks="9" exponent="80"/>
                <reflectance r="0"/>
                <transmittance t="0"/>
                <refraction iof="1.0" ec="1"/>
            </material_solid>
        </julia>
    </surfaces>
</scene>